{
  "session_id": "2026-07-30-phase22",
  "date": "2026-07-30",
  "arm": "baseline",
  "entries": [
    {
      "ts": "2026-07-30T22:11:39",
      "kind": "direction",
      "actor": "human",
      "description": "Directed continuation into phase 22.",
      "artifact_link": "PROTOCOL.md#e5"
    },
    {
      "ts": "2026-07-30T22:11:39",
      "kind": "correction",
      "actor": "ai",
      "description": "Recounted Phase 17's matrix against its stated total and found its PROSE named three open cells while its TABLE showed four. The enumerate-then-count rule is what prompted the recount; the enumerated artifact beat the summary sentence.",
      "via": "structural",
      "artifact_link": "monogate-research/exploration/eml_asymptotic_class_phase_17_dominates_column_2026_06_24/FINDINGS.md"
    }
  ],
  "findings": [
    {
      "description": "AboveOne x Const closes; matrix 15/25. All four cells Phase 17 left open are now closed.",
      "class": "closure",
      "artifact_link": "machlib/foundations/MachLib/EMLAsymptoticClass.lean"
    }
  ]
}